id,restaurant,section,name,description,price
1061,aj s gourmet grilled cheese shop,grilled cheese,the southern pork grilled cheese,pulled pork smothered in bbq sauce with melted cheddar between 0 slices of sourdough pairs well with our homemade coleslaw served with a pickle and our homemade potato chips,12
1062,acropoli s pizza pasta,pizza,mexicana pizza,seasoned taco meat onions green pepper jalapeno peppers and enchilada sauce smothered with cheddar cheese and served with sour cream on side,15
1063,hawaiian barbeque,seafood platter,regular special garlic shrimp plate,,13
1064,chefs a chicken,chicken,half all white chicken,always fresh never frozen marinated with secret blend of herbs and spices perfectly grilled giving an undeniable taste only 0 chefs could deliver,7
1065,a sweet savory,cookies,half dozen cookies,,18
1066,bushwick s living room,starters,house made guacamole and salsa,ripe hass avocado chili de arbol salsa and freshly made tortilla chips vegan and gluten free,12
1067,a station,fresh rolls,g s roll,assorted fish avocado and cucumber inside with crunchy outside please let us know if you have any dietary restrictions or special considerations,11
1068,accu pizza,pork ribs,large ribs platter,0 pork ribs 0 sides and corn bread,19
1069,gourmet deli,salads,lb sea food salad,,7
1070,riverdale deli,beverages,lipton tea,,1
1071,s all american grill,breakfast favorites,waffles and egg,served with butter and syrup,10
1072,achiote restaurant,es de almuezo sandwiches,cubano sandwich,cuban sandwich,8
1073,presbyterian deli,cereal,corn flakes,0 0 oz,6
1074,ahi sushi,starters,sauteed garlic clams and mussels,,11
1075,agra heights,chicken ties,chicken dan saag,cooked with yellow daal and spinach served with basmati rice,13
1076,up bistro,catering for any occasion,cheese platter,your choice of cheeses,60
1077,accu pizza,hoagies and grinders,meatballs parmesan grinder,,9
1078,acropolis pizza house,acropolis subs,fish acropolis sub,prepared hot or cold with your choice of toppings and dressing,8
1079,hour pizza delivery,pasta,ravioli with shrimp,serves 0,24
1080,caminos mexican restaurant,french toasts,challah french toast with sausage,,6
1081,presbyterian deli,bagels and muffins,bagel with flavored cream cheesem,,2
1082,haight patio and crepery,sweets,nutella crepe,nutella chocolate and powdered sugar,8
1083,al dente,sides,sauteed mushroom,,9
1084,al s italian beef,char grilled chicken sandwiches,grilled onion chicken sandwich,grilled onion mayo ketchup mustard kosher pickles and tomato,8
1085,a l pizza,soup,chicken noodle soup,,6
1086,handles frozen yogurt ice cream ues 0nd ave,seasonal ty softserve,chocolate daydream frozen yogurt no sugar added,,7
1087,ab cafe delish,sub sandwiches,house egg sandwich,0 eggs omelet with chives bell pepper mushrooms feta cheese sliced tomato jalapeno and honey mustard spread,13
1088,guys pies,sides,side of italian sausage,,8
1089,a a gourmet deli,burgers,texas burger with side,cheddar bacon lettuce tomato and bbq sauce,10
1090,amby s restaurant,egg sandwiches,eggs with turkey bacon sandwich,,4
1091,ahimsa vegan cafe,beverages,sparkling water,,3
1092,aji sushi bar,sushi combos,sushi deluxe,california maki and eight pieces of nigiri ushi comes with soup and salad,20
1093,abhiruchi restaurant,lunch south indian ties,uttapam,thick pancake made with lentil rice flour onions and chilies,8
1094,al pacino cafe,pastas,penne cheeses,provolone mozzarella ricotta and parmesan cheeses in a creamy garlic sauce,16
1095,guys sushi,sandwiches,cold spicy tuna tartar,,11
1096,dragon phoenix,lunch beef platter,lbeef with broccoli lunch special platter,served with pork fried rice and choice of side,8
1097,al s corner deli,breakfast sides,ham,,4
1098,aamar indian cuisine,tilapia s,tilapia tamarind,boneless tilapia fillet prepared in homemade spicy sweet and sour tamarind sauce served with plain baash moti rice flavored with cardamom cinnamon bay leaves and whole cumin,14
1099,abir halal restaurant, pizza,one slice pizza,,2
1100,0th element indian restaurant,dum biryani ka khazana,shrimp biryani,saffron flavoured basmati rice with prawns,15
1101,a taste of asia,vegetables,vmixed chinese vegetables,,9
1102,paet rio,noodles,npad see ew noodle,flat rice noodles sauteed with your choice of meat chinese broccoli egg and sweet soy sauce,10
1103,african spice,platter,kak kak,sweet somali snack great with coffee,2
1104,steakhouse,meat and poultry,pan roasted chicken,amish chicken marble potatoes porcini mushrooms and scallions,32
1105,shanghai house,vegetable,sauteed pea shoot,vegetarian,15
1106,miles cuban cafe clybourn,sides,maduros,sweet plantains,5
1107,days restaurant,soup,egg drop soup,,3
1108,0th element indian restaurant,dum biryani ka khazana,egg biryani,saffron flavoured basmati rice with eggs,12
1109,0th avenue donuts,egg sandwiches,two eggs sandwich with meat,served on a roll,6
1110,star pizza wings,sub sandwich,chicken bacon ranch sub,,6
1111,asian kitchen,hawaiian bbq,hgrilled chicken bread,,15
1112,aks halal grill grocery,its a wrap,punjabi wrap,spicy seasoned masala chicken spinach herb tomato basil whole wheat and white wraps,9
1113,hermanos mexican grill,mexican favorite dishes,breaded steak meal,with fries served with rice beans and salad,11
1114,stop pizza deli grocery,sandwiches,grilled chicken caesar wrap,grilled chicken romaine lettuce parmesan cheese and caesar dressing served with cheese lettuce and tomatoes,8
1115,0elements express,platter,veggie delight,avocado three kinds of cheese tomatoes cucumbers sprouts green leaf lettuce and mayo vegetarian,6
1116,akiko s sushi bar,chef sushi combination,rainbow roll and pieces nigiri,,33
1117,agra indian kitchen,vegetables,veggie curry,mixed vegetables cooked in a curry sauce,12
1118,a s fine foods,lunch wraps,honey maple turkey alpine lace swiss wrap lunch,,9
1119,a mi estilo,salad,a mi estilo salad,spinach cucumber cherry tomatoes pistachio red onion and goat cheese,8
1120,0elements,indian flavors,onion and chilli uthappam,uthappam topped with onion chilli and cilantro served with sambhar and chutney,9
1121,caminos mexican restaurant,postres,gelatina de sabores,yellow,3
1122,a p deli,beverages,fountain pop,,2
1123,afghan kabob c ville,side orders,kadu,butternut squash,6
1124,wing spot,chicken,wings,five flavors and three dips,63
1125,s all american grill,chicken sandwiches,grilled chicken breast sandwich,with fresh lettuce and tomato on garlic bread,9
1126,s all american grill,catering panini platter,caprice panini catering,turkey provolone cheese romaine lettuce and tomatoes,60
1127,akiko s sushi bar,temaki,shrimp temaki,spicy shrimp avocado and cucumber,9
1128,tortillas king,quesadillas sincronizadas,0c jack cheese and shrimp chicken and steak quesadilla,0 fresh flour tortillas stuck together and melted cheese,6
1129,acropoli s pizza pasta,pizza,acropolis special pizza,pepperoni canadian bacon sausage black olives mushrooms and tomatoes,15
1130,akashi,ty rolls,pieces airport roll,shrimp tempura and mayo topped with salmon masago and spicy mayo raw,15
1131,a s fine foods,cold sides,breaded broccoli,,3
1132,amby s restaurant,mariscos,breaded shrimp,,14
1133,al basha grill,raw beverages,lemon crush,orange lemon sugar and ice,3
1134,montaditos brickell,montaditos,chistorra cheddar cheese crispy onion and ali oli,,3
1135,adonai deli grocery,sandwiches,chicken pesto panini,grilled chicken roasted peppers and onions mozzarella and pesto,8
1136,al s italian beef,als flavorful wraps,bltc wrap,bacon lettuce tomato sharp cheddar cheese and mayo in a flour tortilla,8
1137,bistro,sizzling hot pot,cod with roasted pork in tofu hot pot,,11
1138,shanghai house,pork,bamboo sprouts with shredded pork,,13
1139,star asian cafe,chicken,ckung pao chicken full dinner,served with egg roll cheese puff and fried shrimp plus choice of soup and rice hot and spicy,16
1140,a a gourmet deli,ty sandwiches,leo s roller sandwich,cracked pepper turkey alpine swiss cheese sun dried tomato romaine lettuce and mayonnaise served on a wrap,7
1141,dragon phoenix,beef platter,hunan beef special platter,served with pork fried rice and choice of side hot and spicy,10
1142,adyar ananda bhavan a0b indian vegetarian restaurant,beverages,masala buttermilk,,2
1143,addis ethiopian restaurant,beef,kitfo addis,traditional style kitfo served with gomen and ayib cheese spicy,16
1144,agra cafe,shrimp,green coconut shrimp,shrimp cooked in green coconut milk herbs and spices,14
1145,abyssinia restaurant cafe,meat,special kitfo,minced beef tossed in kibe spices ethiopian butter chili powder and ayebe ethiopian cheese,16
1146,tara authentic indian cuisine,sweets,rasmalai,steam cheese dumplings soaked in saffron rose flavored condense milk,5
1147,caminos mexican restaurant,burger palace,pizza burger,,6
1148,abner s cheesesteaks,pizza,bbq chicken pizza,bbq sauce grilled chicken and mozzarella,11
1149,acropolis pizza house,salads,antipasto salad,,6
1150,accu pizza,hoagies and grinders,ham and cheese hoagie,made in fresh italian roll with lettuce tomato onions oil mayo and cheese,9
1151,0th element indian restaurant,dum biryani ka khazana,lamb biryani,saffron flavoured basmati rice with lamb,15
1152,stop pizza deli grocery,pizza,buffalo gourmet pizza,bleu cheese hot sauce and chicken,8
1153,kitchen,chicken,chicken with mixed vegetable large,with all white meat chicken and fresh vegetables in sizzling ginger sauce,16
1154,cafe,beverages,fresh brewed farmer brothers coffee,,2
1155,up bistro,cheese sandwiches,pepper jack cheese sandwich,,9
1156,aged steakhouse,sides,creamed spinach,,9
1157,presbyterian deli,presbyterian ,the ranch,hot roasted beef melted provolone lettuce tomato and horse radish dressing,5
1158,akemi,lunch sides,edamame lunch,soybeans and salt,6
1159,kitchen,chow fun,beef chow fun,,16
1160,abdallah s lebanese restaurant bakery,from bakery,labne,,5
1161,tortillas king,teriyaki faijtas,tfteriyaki steak fajitas with cheese,soft tortilla stuffed with onions and peppers,4
1162,a taste of asia,seafood,sfsizzling rice shrimp wor ba,,13
1163,burgers pizza,burgers,bullseye bbq burger,crispy onion straws bacon bullseye bbq sauce cheddar cheese lettuce tomato and mayo on a freshly baked onion bun,9
1164,adamo s pizzeria,subs,philly chicken sub,onions peppers and choice of cheese,9
1165,shanghai house,fish and seafood,fish with spicy bean sauce,,20
1166,akari sushi,udon,vegetable udon,thick rice noodles,7
1167,asian kitchen,platter,apiece honey chicken wings,,10
1168,guys sushi,sandwiches,cold piece sashimi appetizer,,11
1169,brothers breakfast,spread snacks,catfish nuggets,,8
1170,ak s takeout delivery,bbq sides,pork rack,0 ribs,13
1171,in one,steaks,footlong cheese steak hoagie,0 0 lb of 0% sirloin,7
1172,acropolis pizza house,acropolis greek side,chicken souvlaki,,8
1173,degrees pizzeria,pizza,crispy chicken parmesan pizza,chicken cutlet tomato sauce mozzarella cheese and romano cheese,17
1174,a mi estilo,platter,meatballs,minced meatballs in tomato sauce,7
1175,empanadas clark st,empanadas,ratatouille empanada,sauteed carrots red peppers yellow onions zucchini and mushrooms with garlic oregano and cumin please no substitutions sauce not included but available in the sauces section of menu,3
1176,taco house,burritos ,bvegetarian burrito,served with fresh flour tortilla and rice beans iceberg lettuce guacamole tomato and cheddar cheese vegetarian,7
1177,sushi,rice platter,unagi don,bbq eel,15
1178,ristorante italiano,cafe,double espresso,,6
1179,a j pizza restaurant,beverages,bottled apple juice,,2
1180,aged steakhouse,sides,truffle mac and cheese,,10
1181,achina,chefs s,aseasons,chicken jumbo shrimp beef pork and mixed vegetables in a house sauce served with white rice,13
1182,achiote restaurant,ees de almuerzo lunch,pernil,marinated roast pork shoulder,9
1183,a express chinese,pork,pork hunan style,served with white rice hot and spicy,11
1184,juice bar,basic smoothies,green goodness smoothie,kale pineapple mango coconut water ginger,5
1185,adamo s pizzeria,lunch deals,manicotti lunch,comes with garlic bread,8
1186,aiyara thai restaurant,beverages,can soda coke,,2
1187,dragon phoenix,diet dishes,dshrimp with tomatoes and onion diet dish,steamed served with choice of rice and sauce on the side,9
1188,caminos mexican restaurant,on a roll and on a bagel,bacon egg and cheese sandwich,served with choice of cheese,4
1189,aks halal grill grocery,paninis,tuna melt panini,,8
1190,degrees neapolitan pizzeria,beverages,coke zero bottle,,3
1191,bistro,sizzling hot pot,beef and vermicelli in satay hot pot,,11
1192,acropoli s pizza pasta,salads,mozzarella fresca salad,romaine lettuce topped with roasted red pepper fresh mozzarella sliced pepperoncini and crispy bacon with balsamic vinaigrette,14
1193,agra indian kitchen,chef dinner s,vegetarian thali dinner special,,16
1194,burros,platter,traditional benedict,canadian bacon poached cage free eggs hollandaise sauce toasted english muffin served w roasted herbed red potatoes and greens,13
1195,a bellagio italian restaurant,primi,bigoli e coda,bigoli nebbiolo braised piedmontese beef oxtail and asparagus,21
1196,a v p coffee shop,avp sandwich,english muffin,,2
1197,degrees pizzeria,salads,goat cheese and portobello salad,baby field greens and grape tomatoes topped with sauteed portobello mushroom and goat cheese,9
1198,agra cafe,alcohol beer and wine must be 0 to purchase beer wine,blue moon $0,belgian white must be 0 to purchase,4
1199,brother s pizza under new ownership,calzone,meatball calzone,,6
1200,abundant air cafe,paninis,don caprese panino,sopressata salami mozzarella cheese tomatoes fresh basil balsamic vinegar and pesto mayo,10
1201,tortillas king,pasta,ppasta with shrimp chicken and broccoli,the best italian linguine pasta made of semolina sauteed with fresh tomato sauce and cilantro con salsa de tomate,10
1202,chop suey,chow mein,vegetable chow mein,pan fried noodle,6
1203,tortillas king,new burritos,new burritos grilled chicken,dinner size served in large fresh tortillas with french fries beans cheddar cheese guacamole sour cream lettuce tomato and onion,9
1204,ahi hawaiian bbq,seafood,mahi mahi,tenderly prepared fish fillets marinated and lightly breaded popular hawaiian favorite,8
1205,al pacino cafe,sandwiches,schwarma sandwich,served on fresh pita bread with your choice of side,12
1206,a v p coffee shop,avp burgers,california burger deluxe,avocado cheddar cheese and mushrooms,11
1207,paet rio,traditional thai curry,cgreen curry,spicy,10
1208,mission vietnamese chinese,beverages,thai iced tea,,4
1209,aegea,angus brioche burgers,beef burger deluxe,served with salad french fries and a pickle,14
1210,pizza,hot sandwiches,ground beef parmesan sandwich,served on hero bread,8
1211,a town pizza,pizza,pesto pizza,pesto sauce green onions olives tomatoes and mushrooms,17
1212,a pizza,pitas,gyro pita deluxe,,11
1213,agelgil ethiopian restaurant,signature entrees,alecha kikil,fitfit optional succulent lamb cooked to perfection in herb butter seasoned with blended spices and served tit style served spicy hot or not your choice on this item,13
1214,ahmo s gyros deli dexter,ty sandwiches,grilled cheese sandwich,,4
1215,accu pizza,stromboli,pepperoni stromboli,,12
1216,0st chop suey,fried rice,bbq pork fried rice,,5
1217,aaharn by koon thai,aaharn ,mango curry,red curry paste with bell peppers basil and mango in coconut milk,15
1218,a l pizza,hot heros,sausage hero,,8
1219,akari sushi,sushi and sashimi,eel,0 pieces,6
1220,abeautifullife jamaican cafe,bowls and entrees,jerk marinate,take a taste of the caribbean home with you perfect for marinating chicken fish veggies steak and lamb,15
1221,tortillas king,ranch fajita,rfranch steak fajita,soft tortillas stuffed with onion and peppers,3
1222,haight patio and crepery,beverages,unsweetened iced tea,,3
1223,absolutely asia,hot pots,bean curd with vegetables,,15
1224,a cut above deli,burgers,classic cheeseburger,served french fries add onion rings for an additional charge,7
1225,shanghai house,vegetable,eggplant w garlic sauce,spicy vegetarian,12
1226,bros pizza,pizza,cheese pie,,12
1227,0i pho indochine cuisine,pho,pho tom yum,pho thai lan spicy tom yum broth with shrimp or chicken and vegetables spicy,13
1228,accu pizza,pizza,medium plain pizza,,12
1229,j s food market at 0nd st,sandwiches,pastrami sandwich,,6
1230,0th element indian grill,indo chinese,vegetable noodles,with choice of veggies served with rice,11
1231,a station,rice and noodle,spicy stir fried seafood udon,udon stir fried with mixed seafood vegetables and spicy sauce please let us know if you have any dietary restrictions or special considerations spicy,14
1232,presbyterian deli,bagels and muffins,egg cheese on english muffin,,4
1233,achina,poultry,kchicken with broccoli,served with white rice,10
1234,west bistro grille,sandwiches,jumbo lump crab cake sandwich,served with lettuce tomato onion and french fries on a freshly baked kaiser roll,20
1235,chop suey,family dinners,family dinner for 0,two large egg drop soups five egg rolls five crab rangoons large seafood combination large general tso s chicken large beef with broccoli large sweet and sour shrimp and large combination fried rice,61
1236,acropolis pizza restaurant,grinders and sandwiches,pastrami and cheese deluxe,lettuce and tomato includes french fries coleslaw and pickle,11
1237,a s fine foods,hot dishes,pork marsala,,12
1238,a taste of asia,poultry,chhot pepper chicken,hot and spicy,10
1239,dragon phoenix,chefs ties,adragon and phoenix,0 quart jumbo shrimp with szechuan sauce and general tso s chicken served with choice of rice hot and spicy,14
1240,a mis of rock hill,sandwiches,bbq burger,patty topped with bbq sauce,9
1241,aki steak sushi,hibachi lunch,hibachi combo teriyaki lunch,served with soup or house salad hibachi vegetables and steamed rice or fried rice,18
1242,stop pizza deli grocery,hot sandwiches,chicken gyro,white chicken gyro and tzatziki sauce with lettuce tomatoes and onions,6
1243,tastes thai cuisine,platter,crab rangoon,cream cheese mixed with crab meat wrapped in wonton skin and then deep fried,7
1244,presbyterian deli,beverages,best cocktail juice,0 oz,4
1245,chairs soho,sandwiches,grilled chicken sandwich,on ciabatta with 0 chairs mustard dressing and tomato,16
1246,afghan kebab grill,sides,chicken korma side,stew chicken tenderly cooked with onions fresh tomatoes bell peppers herbs and spices,8
1247,a pizza mart,s,large topping pizzas special,0 large pizzas with any 0 toppings,26
1248,akiba,platter,japanese style garlic fries,,6
1249,agra heights,nonvegetarian appetizers,fresh shrimp,shrimp cooked in bengal style and served with poori bread,9
1250,akbar,lamb ties,saag meat,lamb cooked with cream spinach coriander and herbs,18
1251,up bistro,breakfast hot,fbagel with cream cheese,bage l roll or sliced bread wheat white and rye,4
1252,chop suey,egg foo young,chicken egg foo young,served with rice,6
1253,garcia s mexican sea food restaurant,breakfast burritos,egg and ham breakfast burrito,extra items $ 0 each,3
1254,tastes thai cuisine,salads,pra goong,steamed shrimp with onions lemongrass tomatoes mushrooms and scallions mixed with lime juice and chili sauce on a bed of lettuce served with steamed rice spicy,16
1255,absolutely outrageous gyros and phillies,soups and appetizers,coleslaw,,5
1256,tortillas king,fajita,chicken fajita and guacamole,an 0 salt tortilla stuffed with a choice of filling,3
1257,a town pizza,pizza,garlic supreme pizza,cheese white creamy sauce chopped tomatoes italian sausage pepperoni mushrooms green onions and garlic,17
1258,star asian cafe,pho vietnamese style,nsseafood noodle soup vietnamese style,,12
1259,a a gourmet deli,hot sandwich combo,chicken steak sandwich combo,chicken steak peppers onion and melted american cheese,9
1260,way restaurant,ricas saludables ensaladas rich and healthy salads,ensalada mixta con aguacate,mixed salad with avocado,6
1261,0gingers,eggomania,veggie omelet,indian style masala omelet mixed with veggies,5
1262,up bistro,cheese sandwiches,fresh mozzarella sandwich,,8
1263,dragon phoenix,new house ,sshrimp with mixed vegetable house special,served with choice of noodle,11
1264,0st chop suey,beef dishes,moo shu beef dish,served with four pancakes and hoisin sauce,10
1265,absolute noodle,nigiri and sashimi,octopus,two pieces,5
1266,0elements express,breakfast favorites,pancake combo,stack of pancakes 0 eggs and choice of meat,6
1267,ahi sushi,platter,creamy salmon crispy rice dish,,15
1268,presbyterian deli,breakfast platter,power breakfast wrap,egg whites swiss cheese turkey and tomato,5
1269,a taste of asia,seafood,sfimperial shrimp,hot and spicy,11
1270,empanadas southport,sauces,side of red hot sauce,roasted jalapenos aji molido tomatoes paprika red onion and garlic,1
1271,dragon phoenix,ties,half fried chicken,,6
1272,achina,poultry,kchicken with black bean sauce,served with white rice,10
1273,sushi,nigiri,tako nigiri,0 pieces octopus,5
1274,smoke house barbeque,smoked chickenand tips,fried rib tips,smoked to perfection,7
1275,aiyara thai restaurant,sweets,homemade coconut ice cream,,5
1276,j s food market at 0nd st,sandwiches,applewood smoked turkey wrap,,6
1277,acacia bistro,platter,house romaine salad,honey chipotle dressing,10
1278,a s fine foods,lunch pasta salads,farfalle pasta salad lunch,with sauteed broccoli and bocconcini,7
1279,aki steak sushi,sashimi,sflying fish egg tobiko sashimi,0 pieces,7
1280,a express chinese,platter,cbeef with broccoli,served with egg roll and pork fried rice,10
1281,0th cafe,0 egg omelettes,the greek omelette,green peppers red onion olives pepperoncini tomato feta cheese w side of wheat toast tots,12
1282,0th element indian restaurant,platter,full mirchi with onions,large hot green peppers with onions batter dipped and gently fried,7
1283,aks halal grill grocery,large fresh fruit smoothies,birthday smoothie,large strawberry cream cheese taro vanilla extract,7
1284,degree pho,banh mi baguette,special bbq banh mi,sliced bbq beef shredded bbq chicken mayo house pickle cucumber jalapeno and cilantro,8
1285,a place by damao,chengdu snack,wonton in chicken soup,hand made wonton and special chicken broth,10
1286,chefs a chicken,chicken,half all white chicken value meal special,rice and beans always fresh never frozen marinated with secret blend of herbs and spices perfectly grilled giving an undeniable taste only 0 chefs could deliver,8
1287,0th st deli grill corp,beverages,french vanilla,,2
1288,0st chop suey,beverages,mango smoothie,,3
1289,tortillas king,taquitos,steak taquitos,0 crispy corn tortilla rolled with rice bean tomatoes sour cream guacamole and cheese,8
1290,caminos mexican restaurant,american breakfast,eggs with turkey,,7
1291,senses,sandwiches,chicken and steak hoagie,comes w lettuce tomato mushrooms onions cheese,19
1292,akari japanese restaurant,sushi,japanese scallop sushi,0 pieces hotate,7
1293,stop pizza deli grocery,signature salads,greek supreme salad,iceberg lettuce stuffed grape leaves anchovies tomatoes cucumbers green peppers red onions and eggs served with choice of bread and dressing,10
1294,chefs a chicken,chicken,regular extra boneless breast,,4
1295,al pacino cafe,sandwiches,natural pita sandwich,grilled eggplant sauteed with artichoke hearts scallions red peppers and tomatoes topped with feta cheese served on fresh pita bread with choice of side,12
1296,fortunes,combination appetizers,fried jumbo shrimp chicken wings egg roll and crab rangoon combo,,10
1297,ristorante italiano,soup appetizers and salads,calamari fritti,fried fresh monterey calamari,15
1298,agra indian kitchen,beverages ity,mango lassi,,4
1299,star pizza,platter,large garlic bread with cheese,,4
1300,absolutely asia,rice,subgum fried rice,choice of pork beef chicken shrimp or vegetable,12
1301,seasons cafe,shake,carrot patch shake,baa carrot and mango,6
1302,china,combination platter,hunan shrimp combo plate,served with pork fried rice and egg roll or crab rangoon hot and spicy,8
1303,al s corner deli,beverages,homemade lemonade,,2
1304,ahmo s gyros deli dexter,side orders,chicken fries,,4
1305,amby s restaurant,picaderas,picadera 0,0 pieces,27
1306,aburi sushi,classic sushi,piece seared garlic tuna sushi,contains wasabi,5
1307,brothers bbq,platter,pulled pork plate,include 0 sides and corn muffin,14
1308,al basha middle eastern,platter,manakeesh,made with thyme seeds zaatar and olive oil vegetarian,3
1309,burgers pizza,burgers,mushroom swiss burger,fresh sauteed mushrooms and melted swiss on a freshly baked deli bun brushed with a hint of garlic butter,9
1310,caminos mexican restaurant,super sandwiches,chicken parmigiana sandwich,marinara sauce and mozzarella cheese,7
1311,agra indian kitchen,vegetables,aloo gobi,fresh cauliflower and sauteed potatoes cooked with mild spices,12
1312,aks halal grill grocery,groceries households essentials,dole pineapple juice,big 0 oz can,6
1313,ginza sushi,kitchen appetizers,atempura appetizer,deep fried shrimp and vegetables,8
1314,adam s bagels deli,classic homemade salad,tortellini salad,,4
1315,akiko s sushi bar,sushi maki rolls,tekka maki roll,bluefin tuna roll scallion shiso avocado sesame,13
1316,a station,sushi,shrimp sushi 0pc,please let us know if you have any dietary restrictions or special considerations,5
1317,accent thai kitchen,fried rice,raccent fried rice,chicken wings onion scallion tomato carrot and egg,13
1318,0gingers,shuruwat appetizers,spring onion pakora,chopped fresh green spring onions dipped in gram flour and deep fried vegan,6
1319,smoke house barbeque,starters,pulled pork nachos,,9
1320,up bistro,signature sandwiches,the blazing saddle sandwich,served with blazing buffalo chicken pepper jack cheese hot peppers lettuce tomatoes and onions,11
1321,a sushi ny,chefs rolls,spicy mama roll,spicy tuna spicy salmon spicy yellowtail crunchy and avocado with soy nori,13
