id,restaurant,section,name,description,price
808,a place by damao,some sweet,iced water cake with brown sugar and dried fruits,,5
809,guys pizzeria,homemade bake pasta,manicotti,,11
810,akari sushi,rolls,spdynamite roll,0 pieces salmon avocado and crabmeat inside deep fried with eel sauce mayo and hot sauce,11
811,hermanos mexican grill,omelets and breakfast burritos,spinach and cheese omelet,spinach and american cheese served with toast and hash browns,9
812,accent thai kitchen,noodle,nkua noodle,sauteed flat noodle with egg onion scallion bean sprouts and lettuce,13
813,adam s bagels deli,boars head cold cuts and sandwiches,lb bologna,,6
814,days restaurant,dinner s,dhunan beef dinner,served with egg roll and rice spicy,9
815,ny presbyterian deli,breakfast platter,pancakes,,5
816,presbyterian deli,miscellaneous,scott tissue,,1
817,chop suey,thai entrees,basil entree,,12
818,aburi sushi,shares,organic agedashi tofu,yuzu citrus green onion and shredded nori,3
819,achina,dinner ties,croast pork chow suey dinner combination,includes fried or steamed rice and choice of egg roll or crab rangoon,8
820,sushi,dinner bento combo box,double premium entrees and entree bento combo box dinner,,21
821,abo s pizza,sweets,dessert cup,,4
822,a v p coffee shop,sides,side vegetable,,4
823,abo youssef,fresh beverages,fresh carrot juice,,4
824,tara authentic indian cuisine,lamb and goat ,lamb korma,succulent meat cooked with cashew nut sauce all entrees served with basmati rice,18
825,gourmet deli,breakfast,bagel with beanut butter and jelly roll,,2
826,smoke house barbeque,sweets,peach cobbler,,6
827,taco house,super fajitas,fchicken super fajitas,served with onion peppers lettuce tomatoes and guacamole rice beans and six flour tortillas served on the side,16
828,s all american grill,fountain service,ice cream soda,choice of vanilla chocolate oreo or strawberry,6
829,parish,lunch side dishes,plantain chips lunch,made in house fresh daily,4
830,ajs sandwiches,burgers,burstrami burger,0 0 lb of all natural ground beef grilled pastrami topped with swiss cheese,9
831,0st ave gourmet deli,beverages,iced coffee,,3
832,tortillas king,honey mustard fajita,hmhoney mustard chicken fajita and cheese,soft tortillas stuffed with onion and peppers,3
833,akashi,beverages,homemade iced tea,sweetened or unsweetened,2
834,degrees bangkok cafe,barbecue,garlic lover wok,choice of meat stir fried with garlic black pepper onions and green onions on steamed vegetables,12
835,fifth,chicken,jumbo sweet chili wings,thai style sweet with heat siracha ketchup served with 0 dipping sauce,20
836,abiruchi grill,tandoori,shrimp tandoori,peeled and marinated shrimps with indian spices barbecued in tandoor,13
837,ab cafe delish,paninis,classic italian panini,fresh mozzarella feta cheese fresh basil sun dried tomatoes eggplant and balsamic vinegar,14
838,0st ave gourmet deli,beer must be 0 to purchase,corona extra,0 pack 0 oz bottles must be 0 to purchase,16
839,adam s kabob,sandwiches,gourmet falafel sandwich combo,crispy brown croquette made from fresh chickpeas and hint of herbs served with tahini salad potato inside the pita with choice of side and a canned soda,15
840,degrees bangkok cafe,soups,tom yum soup,hot and sour soup with lemongrass mushrooms tomatoes onions and lime juice spicy,11
841,abner s cheesesteaks,sandwiches,turkey sandwich,served with mayo lettuce and tomato on choice of bread,5
842,mile house,dog menu,dog kibble,,4
843,al s beef,0 lb polish with fries,chicago polish,char grilled locally produced 0 0rd lb polish sausage chicago style mustard relish chopped onion sport peppers tomato and kosher pickle spear topped with celery salt and on steamed hot dog bun served with hand cut fries,7
844,aki asian house,raw fish rolls and hand rolls,spicy scallop roll,,11
845,aburi sushi,beverages,iced tea,tropical iced tea non sweetened,3
846,addis ethiopian restaurant,veganvegetarian dishes,pasta spaghetti,a generous 0 portion of spaghetti prepared ethiopian style served with green salad vegetarian vegan,12
847,achina,chop suey,house special chop suey,chicken shrimp and pork served with white rice,9
848,al s corner deli,sandwiches,jewish corned beef sandwich,,5
849,star pizza,pasta,ziti with chicken cutlet,served with oven baked garlic bread,8
850,akbar,lamb ties,rogan josh,a traditional lamb curry covered with chopped onions tomatoes and freshly ground spices,18
851,agra heights,biryani s,chicken biryani,chicken cooked with biryani masala and rice,14
852,ai sushi sake grill,korean s,kimchi jigae,kimchi and chopped pork in homemade spicy broth,16
853,akari japanese restaurant,sides,miso soup,,2
854,new taco grill,salad,fresh garden salad with grilled chicken,served with lettuce tomato cucumber and carrot dressing is served on the side,7
855,abundant air cafe,hot stuff,abundant hot chocolate,served with guittard syrups classic hot chocolate or black and white,4
856,taco house,super fajitas,fchicken and steak super fajitas,served with onion peppers lettuce tomatoes and guacamole rice beans and six flour tortillas served on the side,18
857,akari japanese restaurant,sides,side fried rice,,5
858,0gingers,murgha and mutton di rasol meat entree,amchuri murgh,tender cubes of chicken breast cooked in a chef s special mango flavored spicy sauce,12
859,star asian cafe,seafood,sfbasil fish,served with steamed rice,17
860,al capone,pizza,chicken broccoli pizza,,20
861,degrees pizzeria,hot grinders,chicken ranchero hot grinder,chicken bacon ranch lettuce and american cheese,9
862,ahi hawaiian bbq,ahi combinations,chicken and short ribs combo,tasty tender bbq chicken and short ribs,10
863,caminos mexican restaurant,platter,huevos con jamon,eggs with ham,8
864,agra cafe,rice and biryani,zeera rice,steamed white basmati rice with cumin seeds,4
865,a pizza mart,pizza,italian pizza,kalamata olives artichoke hearts feta cheese mozzarella cheese and red sauce,14
866,0i pho indochine cuisine,rice and fried rice,indonesian beef fried rice,sliced beef satay jalapeno and chili pepper spicy,12
867,a oriental kitchen,chicken,chicken with onion in curry sauce,hot and spicy,6
868,guys pizzeria,calzones and rolls,stromboli,peppers onions sausage and pepperoni,10
869,akiko s sushi bar,nigiri sushi,uni nigiri,sea urchin,17
870,new taco grill,mexican rice,mexican rice with tex mex chili,ground beef with onions and peppers,7
871,aamar indian cuisine,breads,cheese naan,naan bread stuffed with shredded cheese and with a touch of butter,4
872,absolute thai,side items,side of beef,,3
873,go sushi,house roll,baked dynamite roll,,13
874,ahimsa vegan cafe,addons,add guacamole,,2
875,airways pizza gyro restaurant,pizza,baked ziti pizza,,12
876,adam s bagels deli,classic sandwiches,club sandwich,ham turkey melted cheese bacon lettuce tomato onions and ranch,8
877,agra heights,seafood curry ties,shrimp tandoori masala,bbq style shrimp cooked with tomato cream sauce served with basmati rice,17
878,adam s kabob,sandwiches,chicken shawerma sandwich combo,thin slices of marinated chicken cooked on a slowly revolving rotisserie served in a delicious wrap laffa style filled with potato and our homemade garlic sauce with choice of side and a canned soda,15
879,gourmet deli,side orders,large fries with cheese,,4
880,public house,sandwiches,grilled chicken wrap,grilled chicken green onions yellow squash avocado tomatoes and bell peppers in a flour tortilla served with a side of mixed greens salad,9
881,a pizza,sandwiches,sausage parmigiana grinder,,8
882,al bos eurocafe bakery,barbecue,mixed grill mjesano meso,chicken raznjici skewer with onion and peppers small pljeskavica seasoned beef patty cevapcici little sausage links kranjska kobasica large sausage link with french fries and djuvec rice,17
883,accu pizza,half and half dinner deal,dinner deal,0 0 rack of pork ribs and 0 0 chicken with 0 sides and 0 pieces of corn bread,30
884,absolutely asia,hot pots,seafood with bean curd,,17
885,0th element indian restaurant,platter,mutton haleem,,11
886,paet rio,house ,hgung op wonn sen,steamed shrimp with glass noodles napa cabbage scallion ginger soy sauce white pepper powder oyster sauce and celery,13
887,0th st pizza co,pizza,all meat pizza slice,,6
888,aki steak sushi,sushi rolls,rcucumber roll,0 pieces cucumber with sesame seeds in a traditional style vegetarian,5
889,a cut above deli,fresh from garden,greek salad with chicken,,7
890,afghan kebab grill,seafood,sizzling tandoori shrimp,jumbo shrimp marinated in tandoori masala and sizzled with fresh onions bell peppers garlic ginger herbs and spices served with rice salad and afghani bread,20
891,a pizza,italian dinners,chicken parmigiana dinner,,14
892,brother s pizza under new ownership,stuffed shells,stuffed shells with sausage,,10
893,aburi sushi,sushi sashimi combo,sushi and sashimi appetizer,,9
894,j s food market at 0nd st,ity sandwich,blt sandwich,choice of bread bacon lettuce tomato and touch of mayonnaise or ranch dressing,6
895,adamo s pizzeria,mammas wraps,breakfast wrap,eggs bacon maple sausage fries mozzarella and maple syrup,8
896,go sushi,house roll,sexy roll,,14
897,abdallah s lebanese restaurant bakery,beverages,tea with mint pot,,4
898,pizza,meal and beer must be 0 to purchase,any two pizzas and a pack of beer special,must be 0 to purchase,30
899,stop pizza deli grocery,beverages,red bull,,3
900,a express chinese,seafood,shrimp with pepper and tomato,served with white rice,7
901,sushi,sushi and sashimi combo,sushi boat combo,0 pieces of sashimi 0 pieces of sushi 0 pieces california roll and a 0 pieces spicy tuna roll,40
902,new taco grill,combination platter,sgrilled chicken and guacamole combo plate,served with mexican rice black or pinto beans lettuce tomato 0 fresh tortillas sour cream salsa ranchera on the side and free soda,12
903,mission vietnamese chinese,seafood rice platter,shrimp with bok choy rice plate,,10
904,achiote restaurant,platter,alcapurrias de carne,little grated root vegetable fritters stuffed with ground beef,6
905,meridian grill,sashimi,slices smoked salmon sashimi,,12
906,a pizza,platter,fried mushrooms,,8
907,abdallah s lebanese restaurant bakery,ty platter,baked kibbe platter,served with 0 sides,12
908,0st chop suey,seafood dishes,shrimp with cashew nuts dish,served with plain rice,7
909,s all american grill,breakfast favorites,hungry human,stack of pancakes with two eggs any style served with ham bacon and sausage,15
910,apan asian vegan cuisine,soups and salads,shijiki salad,with edamame peas,6
911,taps,sweets,chocolate brownie a la mode,served with vanilla ice cream,10
912,afghan kebab grill,karae dishes,chicken kara e,served with rice salad and afghani bread freshly cooked in a pan with tomatoes onions bell peppers chickpeas herbs and spices,17
913,chop suey,chicken,sweet and sour chicken,served with rice,7
914,bistro,baked rice and spaghetti,seafood in baked rice,,9
915,de mayo mexican restaurant,kids menu,kids cheese nachos,,9
916,aegea,entrees,shrimp parmigiana entree,served with choice of pasta or salad and bread,19
917,agora taverna,platter,tzatziki spread,yogurt cucumber garlic mint dill,8
918,acropolis pizza restaurant,pasta,pasta,,14
919,a taste of asia,combination,cchicken with mixed vegetables combo,,9
920,up bistro,hot sandwiches,hot roast beef sandwich,hot roast beef sandwichwith cheese lettuce tomato onion on the hero,9
921,chefs a chicken,beverages,gatorade,,2
922,chop suey,chow fun,shrimp chow fun,with rice noodles,11
923,empanadas division,beverages,perrier,,2
924,agra heights,seafood curry ties,crab mali,cooked with coconut cream sauce served with basmati rice,16
925,thai cuisine,vegetables,mixed vegetables,sauteed mixed vegetables and bean cured with tomato sauce and oyster sauce,13
926,aachi s indian cuisine,tandoori,tandoori wings,marinated in aromatic spices baked off in a high temperature clay oven called a tandoor,12
927,ahi sushi,ahi sushi rolls,spicy oriental roll,,9
928,abc pizza,meat subs,steak and egg sub,,7
929,accent thai kitchen,vegetables,vsauteed mixed vegetables and tofu,served with choice of sauce,12
930,abner s cheesesteaks,steaks chicken steaks and sandwiches,pizza steak,marinara sauce and provolone cheese,9
931,aegea,greek ties,falafel sandwich,served with lettuce tomato onions and tzatziki sauce,10
932,al basha grill,entrees,shish tawook,0 skewers of chicken chunks marinated with special spices served with 0 sides soup house salad rice hummus or fries,15
933,agra cafe,lunch chicken dishes,lunch chicken tikka no sauce,boneless skinless chicken marinated in yogurt herbs and spices and broiled in a tandoori oven served with two vegetables rice naan and raita,10
934,ak s takeout delivery,hot subs,buffalo bomb hot sub,buffalo chicken and bleu cheese sauce,8
935,chop suey,fried rice,crabmeat fried rice,,6
936,meridian grill,sushi spicy roll,pieces crab spicy rolls,inside cucumber outside spicy mayo sesame seeds cooked,6
937,a town pizza,platter,jalapeno poppers,0 pieces,7
938,aegea,side orders,pita bread,,1
939,ton tony s pizza,pizza,cauliflower crust pizza,comes with mozzarella extra toppings for an additional charge,11
940,adam s egg,burgers,adam s veggie burger,made from fresh veggies,9
941,s all american grill,beer must be 0 to purchase,blue moon,must be 0 to purchase,7
942,taco house,burritos ,bsteak burrito,served with fresh flour tortilla and rice beans iceberg lettuce guacamole tomato and cheddar cheese,8
943,akbar,rice ties,pullau begam bahar,special rice cooked with sliced lamb chicken shrimp and a mixture of freshly ground spices almonds and raisins,19
944,hawaiian barbeque,platter,0b medium low carb combo plate,short ribs bbq beef 0 bbq chicken and 0 eggs,11
945,up bistro,beverages,monster,,4
946,al masri egyptian restaurant,entrees,ru a bil sabanekh,egyptian spinach pie served with rice pilaf and daily vegetable,20
947,agra cafe,s,agra vegetarian special for one,served with a piece of samosa an onion bhajee choice of one vegetable dish rice naan and dessert,17
948,montaditos,sweets,tarta de santiago,moist and delicious almond cake typical from the region of galicia northwest spain,5
949,presbyterian deli,lunch sandwiches,cracked pepper mill sandwich,pepper turkey melted american lettuce tomato and honey mustard,5
950,montaditos brickell,montaditos,smoked salmon cream cheese fresh tomato and arugula,,3
951,abner s cheesesteaks,sandwiches,roast beef wrap,lettuce tomato and mayo,7
952,agra cafe,ty balti stews,shrimp balti,a rich and hearty stew with a good balance of hot and sweet spicing balti stews include chopped onions green peppers turmeric cumin garlic ginger and crushed tomatoes they are garnished with yogurt and fresh tomatoes and are served in a hot halli panhich with a side of rice,17
953,taco house,mexican rice,mexican rice and mixed vegetable,vegetarian,5
954,abundant air cafe,paninis,caprese panino,mozzarella cheese tomatoes fresh basil balsamic vinegar and pesto mayo,9
955,meridian grill,sushi nigiri,pieces quail egg nigiri,,3
956,al s beef,fresh cut french fries,chili fries,voted one of the top 0 best in the usa,4
957,akiko s sushi bar,platter,shitake mushroom avocado and cucumber maki roll,,11
958,bagels subs,breakfast favorites,bagel with peanut butter,,3
959,a v p coffee shop,avp club sandwich,roast beef club sandwich,swiss cheese lettuce and tomatoes,10
960,agra cafe,rice and biryani,chicken biryani,basmati rice with chicken raisins almonds and peas,13
961,aki steak sushi,japanese lunch,maki d lunch,pick 0 roll with 0 chef s nigiri and 0 sashimi served with miso soup or salad,21
962,ahi sushi,fusion sushisashimi,yellowtail belly with micro greens,with garlic flavored olive oil and ponzu sauce,19
963,public house,burgers and sandwiches,house burger,0 oz ground beef patty on a sesame seed bun topped with lettuce tomatoes onions pickles and mayonnaise and two toppings of your choice served with fries,11
964,a v p coffee shop,avp wraps,grilled veggie wrap,broccoli zucchini mushrooms carrots and mozzarella cheese,10
965,abbey s real texas bbq,starters,smoked burnt ends,the slightly charred yet flavorful bark from the beef brisket and pork shoulder,11
966,absolute noodle,nigiri and sashimi,sea urchin,two pieces,8
967,adobo grill,tacos,camaron tacos,ancho dusted fried shrimp watercress carrots romaine sriracha mayo cheese,17
968,burros,mexican inspired entree salads,el waldorf,kale romaine dried cranberries seasonal apple roma tomatoes caramelized pecans radish red cabbage,13
969,star pizza wings,platter,garlic cheese bread sticks,,9
970,0st chop suey,chefs ties,shrimp and scallop kow specialty,jumbo shrimp and scallops sauteed with vegetables in house special sauce served with plain rice,12
971,0elements express,super sandwiches,super submarine sandwich,salami mortadella bologna honey ham provolone and american cheese on an 0 inch roll with italian dressing mayo mustard lettuce and tomatoes,7
972,a oriental kitchen,house s,sfried scallops,0 pieces,4
973,ak s takeout delivery,sandwiches,fried chicken fillet sandwich,,7
974,aj s ranch road grill,barbeque platter,hungry man s combo plate,0 0 lb brisket 0 0 lb sausage and 0 0 lb pork ribs served with 0 sides,15
975,days restaurant,chop suey,beef chop suey,with white rice,6
976,abe s pizza,beverages,arizona tea,,2
977,al basha grill halal meat,platter,hummus,mashed fresh chickpeas mixed with sesame tahini paste fresh lemon juice garlic and extra virgin olive oil comes with pita bread,5
978,mission vietnamese chinese,chicken rice platter,curry chicken rice plate,,10
979,ai sushi sake grill,bento box,teriyaki bento box,served with salad 0 piece california roll chicken egg roll and steamed rice,17
980,ahjoomah s apron,extras,hard boiled egg,,2
981,miles cuban cafe armitage,house ties,vaca frita,crispy shredded beef onion mojo de ajo served with white rice and black beans,20
982,peruvian bistro,0 nikkei makis,salmon acevichado,nikkei style sushi filled with kani crab salad and avocado topped with thinky sliced salmon and house aji amarillo acevichado sauce,11
983,aks halal grill grocery,foreign burgers,chimichurri burger,lettuce tomato avocado chimi sauce ketchup mayo with swiss cheeze,8
984,affy s premium grill,hot hors doeuvres,crispy fried lemon fish fingers,texas style fried fish fingers seasoned with pepper and fine lemon twist with affys mayo,13
985,presbyterian deli,beverages,gourmet house blend coffee,fresh beans,1
986,0th donut hole,donuts,blueberry cake,glazed,1
987,ton tony s pizza,appetizers and more,garlic knots,,6
988,abbey s real texas bbq,platters,beef brisket platter,served with two sides and garlic bun,27
989,stop pizza deli grocery,platter,cajun turkey club,served with lettuce tomato mayo and your choice of bread served with a choice of side,8
990,amby s restaurant,breakfast,eggs any style with ham and grits or home fries and toast,any extra eggs 0 0 ham 0 0,6
991,ajiacos colombian food,main entrees,carne a la plancha,grilled steak,17
992,akasaka restaurant,lunch,saba shioyaki lunch,broiled mackerel with salt served with soup salad and rice,13
993,cafe,omelettes,classic california abc omelette,cruising with avocado bacon and cheddar cheese,11
994,ak s takeout delivery,fresh chicken fingers chickenand whole wings,fingers,,16
995,aamar indian cuisine,platter,motor ponir makhani,contains dairy product green peas and homemade ponir cheese prepared in a special tomato buttery cream sauce with methi leaves ~ chef s special masala sauce,13
996,montaditos brickell,collections,meat lover collection,comes with 0 montaditos 0 philly steak and cheddar cheese 0 chistorra and brie cheese 0 meatballs with marinara sauce manchego cheese and roasted peppers 0 bbq pulled pork cream cheese bacon and ali oli and 0 grilled chicken roasted peppers fresh tomato and ali oli,10
997,ak s takeout delivery,bbq sides,chicken breast,0 pieces,8
998,taco house,side orders,0c side steak,0 oz,6
999,sushi,platter,green mussels,0 pieces baked green mussels with spicy mayo sauce onion and tobiko spicy,6
1000,aks halal grill grocery,salads make ur own,create your own salad,choice of romaine iceberg or spring mix or spinach choice of one meat grillchicken crispy chicken lamb steak and four vegetable toppings of your choice options for salmon shrimps etc available as well with extra charges please write everything you would want the chef to do to make your experience great,9
1001,a cut above deli,ty sandwiches,pastrami and swiss onion roll sandwich,hot pastrami swiss cheese and your choice mustard on a large onion roll,9
1002,akbar restaurant,platter,chana pindi,chickpeas cooked in a traditional method with over 0 types of spices spicy sweet and sour,11
1003,bite grill,seasonal market vegetables,sweet chili roasted carrots,dressed with sweet chili garlic sauce,4
1004,star asian cafe,pork,pszechuan pork,served with steam rice hot and spicy,13
1005,tortillas king,soup,0a steak and vegetable soup,with corn tortilla chips,3
1006,acropolis pizza restaurant,grinders and sandwiches,roast beef lettuce tomato and cheese deluxe,includes french fries coleslaw and pickle,11
1007,stars pizza,seafood,fried calamari,,9
1008,absolute noodle,dinner curry,panang curry,peanut curry with broccoli carrot bamboo string bean bell pepper and basil,12
1009,peruvian bistro,tiraditos,tiradito de tuna tataki,daikon scallions seared tuna sesame seeds with 0 house ponzu sauce,11
1010,acacia bistro,sandwiches,grilled chicken avocado sandwich,rosemary fries swiss cheese bacon,15
1011,empanadas,chips,bbq chips,kettle cooked,2
1012,al capone,lunch cold subs,ham and cheese cold sub junior,,16
1013,paet rio,house ,hkhua kling,khua kling paste sauteed with pork belly and lime leaf spicy,11
1014,aegea,sandwiches,angus wrap,angus burger with lett tom onion pickle american cheese ketchup and mayo,11
1015,dragon phoenix,lo mein,roast pork lo mein,soft noodle,6
1016,al hamra,platter,papadum,crispy crackers made with lentil flour,4
1017,abhiruchi restaurant,platter,paneer pakora,cheese cubes with chickpea dumpling,8
1018,aji sushi bar,soups and salads,house salad,fresh lettuce with sesame dressing,6
1019,presbyterian deli,bagels and muffins,roll with peanut butter,,2
1020,stop pizza deli grocery,pancakes waffles and french toast,waffles platter 0,0 waffles served with your choice of 0 sides served with syrup powdered sugar and whipped cream,9
1021,up bistro,cheese sandwiches,sliced mozzarella cheese sandwich,,8
1022,brothers breakfast,classic breakfast platter,whiting and grits platter,served with biscuit and two eggs,13
1023,0th street seafood seafood market,chicken fresh to order,baked chicken wings,,9
1024,achita sushi,sushi and sashimi,seared tuna,,6
1025,a s fine foods,lunch sandwiches,panko flounder filet sandwich lunch,served with lettuce and tomato,8
1026,absolutely asia,soups,house special seafood soup,,7
1027,agra heights,biryani s,lamb biryani,lamb cooked with biryani masala and rice,15
1028,abc pizza,salads,grilled chicken salad,served with pita and choice of salad dressing,7
1029,caminos mexican restaurant,burger palace,cheddar burger deluxe,,7
1030,degrees pizzeria,sandwiches,chicken caesar wrap,grilled chicken romaine lettuce grated romano cheese and caesar dressing,9
1031,aburi sushi,noodle soup,shumai soup,,8
1032,accent thai kitchen,seafood,dsquid basil,sauteed squid onion mushroom bell pepper and garlic in chili basil sauce hot and spicy,14
1033,0th element indian grill,tandoor varieties,mixed tandoor,combination of grilled chicken chicken tikka shrimp tandoori seekh kebab minced lamb flavored with herbs boti kabab cube of lamb and  unleavened tandoor baked bread served with rice,22
1034,aks halal grill grocery,nachos,one meat punjabi chicken nachos,spicy masala chicken,11
1035,a mis of rock hill,platter,eggplant parmigiano,,9
1036,akemi,sushi rolls,rainbow roll,crab and avocado topped with assorted fish and tobiko,16
1037,adam s bagels deli,boars head cold cuts and sandwiches,virginia ham sandwich,,7
1038,acropolis pizza restaurant,salads,chef s salad,,9
1039,montaditos,tapa,chicken strips tapa,,6
1040,ahjoomah s apron,catering,jopche vegetarian no meat,0 qt pan filled with vermicelli potato noodles stir fried with mushrooms and vegetables,65
1041,ab cafe delish,beverages,freshly brewed coffee,,2
1042,ahi hawaiian bbq,beverages,bottled water,,1
1043,burgers wings,burgerlicious,breakfast over easy burger,topped with thick cut peppered bacon ketchup romaine and a fried egg,10
1044,presbyterian deli,beverages,vitamin water,,2
1045,absolutely outrageous gyros and phillies,soups and appetizers,skinny fries,,8
1046,a mis of rock hill,sandwiches,italian hamburger,patty mixed with diced green pepper and onion topped with tomato sauce,9
1047,presbyterian deli,breakfast sandwiches,egg cheese sandwich,,2
1048,a pizza,sandwiches,turkey melt,,7
1049,senses,sides dishes,yellow rice,,3
1050,akbar,platter,palak chaat,fresh crispy spinach chopped potatoes sweet yogurt with raisins and mint sauce and chaat masala,7
1051,0inco,off grill,pinchos chuzos,marinated fire grilled pinchos,7
1052,meridian grill,sushi spicy roll,pieces scallop spicy rolls,inside cucumber outside spicy mayo sesame seeds raw,6
1053,aks halal grill grocery,groceries households essentials,each scott or what ever is available in these times according to price,,2
1054,amby s restaurant,combinations,roast pork combo,large rice medium beans salad or sweet plantains and soda,25
1055,al pacino cafe,pizza,golden pizza,buttered garlic tomato sauce potatoes mozzarella and cheddar cheeses red onion and chicken,11
1056,a s fine foods,lunch great deals on hot sandwiches,chicken parm sandwich lunch,,7
1057,restaurant and sushi bar,pastas,mac and cheese,macaroni cheddar mozzarella and cream sauce,15
1058,ak s takeout delivery,sandwiches,grilled chicken sandwich platter,includes regular fries,11
1059,amby s restaurant,dominican breakfast,mangu with cheese and egg and salami,three golpes,8
1060,a a gourmet deli,other hot items,pieces chicken wings,,6
